{
  "envelopeVersion": 1,
  "alg": "ed25519",
  "keyId": "k1",
  "keyEpoch": 1,
  "payload": "ewogICJzY2hlbWFWZXJzaW9uIjogMiwKICAiZ2VuZXJhdGVkQXQiOiAiMjAyNi0xMC0yOFQwNTowNzozMyswMDowMCIsCiAgInZhbGlkVW50aWwiOiAiMjAyNi0xMS0wNFQwNTowNzozMyswMDowMCIsCiAgInNvdXJjZSI6ICJodHRwczovL3d3dy5oYXJ6ZXItd2FuZGVybmFkZWwuZGUvZGVmZWt0bWVsZHVuZ2VuLyIsCiAgInNvdXJjZVNoYTI1NiI6ICI1OWI3OTE5ZDRjZWU2ODgxZDU4MmFmNTk5NGQ1NDFiYjQyYmZmZWJlOWEwOWQ2YzdlZmRkN2JhMjIxMDhjN2M0IiwKICAiZXh0cmFjdFNoYTI1NiI6ICIxMjA4YWZhMzE1MTM0ZDQ0ZTI0NmZlY2FlNjJhYWM5MjJjMjk1MDEwN2RhYWRkYWI3Y2Q4MDhmZDc0MzBlZDhkIiwKICAiZGVmZWN0cyI6IFsKICAgIHsKICAgICAgImlkIjogIjhiZTI3YjM0OWRkZCIsCiAgICAgICJzZXZlcml0eSI6ICJ3YXJuaW5nIiwKICAgICAgInN0YXRpb24iOiA5MiwKICAgICAgIm5hbWUiOiAiUG9wcGVuYmVyZyIKICAgIH0sCiAgICB7CiAgICAgICJpZCI6ICI1NTIxYWY0OWZhZmUiLAogICAgICAic2V2ZXJpdHkiOiAid2FybmluZyIsCiAgICAgICJzdGF0aW9uIjogMTMyLAogICAgICAibmFtZSI6ICJLw7Z0ZSBCcm9ja2VuYmxpY2siCiAgICB9LAogICAgewogICAgICAiaWQiOiAiNmMyNDFkNjVjZTEzIiwKICAgICAgInNldmVyaXR5IjogIndhcm5pbmciLAogICAgICAic3RhdGlvbiI6IDEzMywKICAgICAgIm5hbWUiOiAiRsO2cnN0ZXItTHVkZXdpZy1QbGF0eiIKICAgIH0sCiAgICB7CiAgICAgICJpZCI6ICIwMDk2N2IxM2VlNmYiLAogICAgICAic2V2ZXJpdHkiOiAid2FybmluZyIsCiAgICAgICJzdGF0aW9uIjogMTM1LAogICAgICAibmFtZSI6ICJXb2xmc3dhcnRlIgogICAgfSwKICAgIHsKICAgICAgImlkIjogIjFmNzc3ZDhjYzRiZCIsCiAgICAgICJzZXZlcml0eSI6ICJ3YXJuaW5nIiwKICAgICAgInN0YXRpb24iOiAxMzYsCiAgICAgICJuYW1lIjogIkVja2Vyc3BydW5nIgogICAgfSwKICAgIHsKICAgICAgImlkIjogIjUzNTUwYTNkMGFhYSIsCiAgICAgICJzZXZlcml0eSI6ICJ3YXJuaW5nIiwKICAgICAgInN0YXRpb24iOiAxNTUsCiAgICAgICJuYW1lIjogIlJlaGJlcmdlciBHcmFiZW5oYXVzIgogICAgfSwKICAgIHsKICAgICAgImlkIjogIjk3OTY1MDYwMzI4YSIsCiAgICAgICJzZXZlcml0eSI6ICJ3YXJuaW5nIiwKICAgICAgInN0YXRpb24iOiAxODgsCiAgICAgICJuYW1lIjogIlRldWZlbHNtYXVlciBXZWRkZXJzbGViZW4iCiAgICB9CiAgXSwKICAibm90aWNlcyI6IFsKICAgIHsKICAgICAgImlkIjogIjEyZTg1NTk1ZDc3MyIsCiAgICAgICJzZXZlcml0eSI6ICJpbmZvIiwKICAgICAgInN0YXRpb24iOiAxNDksCiAgICAgICJ0ZXh0IjogIkFDSFRVTkchIEFiIDEuIEphbnVhciAyMDI1IHZlcnNldHplbiB3aXIgdW5zZXJlIG51bWVyaXNjaGUgU3RlbXBlbHN0ZWxsZSBOdW1tZXIgMTQ5IHZvbSBha3R1ZWxsZW4gU3RhbmRvcnQg4oCeS2xlaW5lIE9rZXLigJwgenVtIG5ldWVuIFN0YW5kb3J0IOKAnk3DvGhsZW5iZXJnIEFsdGVuYXVlciBIZXJ6d2Vn4oCcIE41MS44MDMyODYgRSAxMC40NTAxNDQiCiAgICB9LAogICAgewogICAgICAiaWQiOiAiNmM3N2YxNjY4ZWYxIiwKICAgICAgInNldmVyaXR5IjogImluZm8iLAogICAgICAic3RhdGlvbiI6IDE2MywKICAgICAgInRleHQiOiAiRGllIFN0ZW1wZWxzdGVsbGUgMTYzIEJyZW1lcmtsaXBwZSB3dXJkZSAyLDcgS2lsb21ldGVyIGVudGZlcm50IGFuIGRlbiBLYWlzZXJ3ZWcgdmVyc2V0enQuIgogICAgfSwKICAgIHsKICAgICAgImlkIjogIjZiNDI5MWQ4MWMxMSIsCiAgICAgICJzZXZlcml0eSI6ICJpbmZvIiwKICAgICAgInN0YXRpb24iOiA0MywKICAgICAgInRleHQiOiAiQmVpIGRlciBTdGVtcGVsc3RlbGxlIDQzIEhvaGUgVMO8ciDigJMgV2Fzc2Vyc2NoZWlkZSBXZXNlci1FbGJlIGlzdCBkZXIgV2FuZGVyd2VnIHVtIGRpZSBTdGVpbmF0YWxzcGVycmUgZ2VzcGVycnQhIFdhbmRlcmVyIHNvbGx0ZW4gZGVuIGdlZ2Vuw7xiZXIgZGVyIFN0ZWluYXRhbHNwZXJyZSBsaWVnZW5kZW4gV2VnIGFscyBBdXN3ZWljaHJvdXRlIHfDpGhsZW4iCiAgICB9LAogICAgewogICAgICAiaWQiOiAiMzViMGE3MWY0NjFhIiwKICAgICAgInNldmVyaXR5IjogImluZm8iLAogICAgICAic3RhdGlvbiI6IDk5LAogICAgICAidGV4dCI6ICJEaWUgU3RlbXBlbHN0ZWxsZSBIV04gOTkgSMO2cm5pbmdlciBTYXR0ZWxrw7ZwZmUgd3VyZGUgYXVmZ3J1bmQgdm9uIHN0w6RuZGlnZW4gU2FjaGJlc2Now6RkaWd1bmdlbiBkYXVlcmhhZnQgenVyIEhhcnplciBIb2x6ZGFtcGZsb2sgb2JlcmhhbGIgdm9uIE5ldXN0YWR0L0hhcnogdmVyc2V0enQuIgogICAgfSwKICAgIHsKICAgICAgImlkIjogImY0NzdhNmFlNWIxNyIsCiAgICAgICJzZXZlcml0eSI6ICJpbmZvIiwKICAgICAgInN0YXRpb24iOiAxNDEsCiAgICAgICJ0ZXh0IjogIkRpZSBTdGVtcGVsc3RlbGxlIEhXTiAxNDEgTGFzZmVsZGVyIFRyw6Rua2Ugd3VyZGUgZGF1ZXJoYWZ0IGFuIGRlbiBPYmVyZW4gSGFobmViYWx6ZXIgVGVpY2ggYW4gZGVuIEhhcnplciBCYXVkZW5zdGVpZyB2ZXJzZXR6dC4iCiAgICB9LAogICAgewogICAgICAiaWQiOiAiODViMWNkOGU3YmQyIiwKICAgICAgInNldmVyaXR5IjogImluZm8iLAogICAgICAic3RhdGlvbiI6IDkxLAogICAgICAidGV4dCI6ICJadXRyaXR0IHp1bSBIV04gOTEgV2VsdGt1bHR1cmVyYmUgUmFtbWVsc2JlcmcgdMOkZ2xpY2ggOTowMCBVaHIgYmlzIDE3OjAwIFVoci4iCiAgICB9LAogICAgewogICAgICAiaWQiOiAiZjhmNzcwOTJiMDZiIiwKICAgICAgInNldmVyaXR5IjogImluZm8iLAogICAgICAic3RhdGlvbiI6IDE0NiwKICAgICAgInRleHQiOiAiRGllIFN0ZW1wZWxzdGVsbGUgMTQ2IOKAkyBHcm/Dn2VzIFdlaHIgaXN0IGFiIFBhcmtwbGF0eiBTdGllZ2xpdHplY2tlIGF1ZmdydW5kIGRlciBHZWZhaHIgdm9uIFRvZGhvbHphYmJydWNoIG5pY2h0IHp1IGVycmVpY2hlbi4gRWluIGd1dGVyIEF1c2dhbmdzcHVua3QgaXN0IGRhcyBTcGVyYmVyaGFpZXIgRGFtbWhhdXMgw7xiZXIgZGVuIERhbW1ncmFiZW4uIgogICAgfQogIF0sCiAgImNsb3N1cmVzIjogWwogICAgewogICAgICAiaWQiOiAiY2Y1MjQ3MjJmZGRmIiwKICAgICAgInNldmVyaXR5IjogImNyaXRpY2FsIiwKICAgICAgInRpdGxlIjogIlNjaGF1c8OkZ2V3ZXJrIEVocnQiCiAgICB9LAogICAgewogICAgICAiaWQiOiAiYzFmYTc0ZTBhNTJlIiwKICAgICAgInNldmVyaXR5IjogImNyaXRpY2FsIiwKICAgICAgInRpdGxlIjogIlBmZXJkZWJhaG4gUmllc3RlZHQiCiAgICB9LAogICAgewogICAgICAiaWQiOiAiNmRjNWY2MWFkZmFmIiwKICAgICAgInNldmVyaXR5IjogImNyaXRpY2FsIiwKICAgICAgInRpdGxlIjogIkJyYW5kYmVyZyIKICAgIH0sCiAgICB7CiAgICAgICJpZCI6ICIyOGE5NDBkN2JmNmQiLAogICAgICAic2V2ZXJpdHkiOiAiY3JpdGljYWwiLAogICAgICAidGl0bGUiOiAiUnVuZCB1bSBRdWVkbGluYnVyZyDigJMgQWhvbHp3YXJ0ZSAoZW50ZsOkbGx0IHZvcmzDpHVmaWchKSIKICAgIH0sCiAgICB7CiAgICAgICJpZCI6ICIxMjEyNmFkYTJkOTYiLAogICAgICAic2V2ZXJpdHkiOiAiY3JpdGljYWwiLAogICAgICAidGl0bGUiOiAiSnViaWzDpHVtc2hlZnQg4oCTIELDvGNrZWJlcmcgZW50ZsOkbGx0ISIKICAgIH0sCiAgICB7CiAgICAgICJpZCI6ICIwMTgyZWE4NDA1YzEiLAogICAgICAic2V2ZXJpdHkiOiAiY3JpdGljYWwiLAogICAgICAidGl0bGUiOiAiS2Fyc3R3YW5kZXJ3ZWcg4oCTIFBhcGVuYmVyZyBlbnRmw6RsbHQhIgogICAgfSwKICAgIHsKICAgICAgImlkIjogIjVlZTdhNmVkZmU2MyIsCiAgICAgICJzZXZlcml0eSI6ICJjcml0aWNhbCIsCiAgICAgICJ0aXRsZSI6ICJBdWZncnVuZCBkZXIgQmF1YXJiZWl0ZW4gYW0gU2NobG9zcyBXZXJuaWdlcm9kZSB3dXJkZSBkZXIgU3RlbXBlbGthc3RlbiB2b3IgZGFzIHVudGVyZSBTY2hsb3NzdG9yIHZlcnNldHp0LiIKICAgIH0sCiAgICB7CiAgICAgICJpZCI6ICIyYTUxY2RhOTI3ZGQiLAogICAgICAic2V2ZXJpdHkiOiAiY3JpdGljYWwiLAogICAgICAidGl0bGUiOiAiRGVyIFNvbmRlcnN0ZW1wZWwgenVtIEtsb3N0ZXJ3YW5kZXJ3ZWcgYW0gS2xvc3RlciBNaWNoYWVsc3RlaW4gYmVmaW5kZXQgc2ljaCBhbiBkZXIgSGF1c3dhbmQgendpc2NoZW4gZGVtIFdhc2NoaGF1cyB1bmQgZGVyIE11c2lrc2NoZXVuZS4iCiAgICB9LAogICAgewogICAgICAiaWQiOiAiOTNkNjkxNWE0YjRkIiwKICAgICAgInNldmVyaXR5IjogImNyaXRpY2FsIiwKICAgICAgInRpdGxlIjogIkRpZSBBaG9sendhcnRlIGluIFF1ZWRsaW5idXJnIGVudGbDpGxsdCB6dWvDvG5mdGlnIGbDvHIgZGFzIFRoZW1lbmhlZnQg4oCeUnVuZCB1bSBCYWQgU3VkZXJvZGUsIEdlcm5yb2RlIHVuZCBkaWUgV2VsdGVyYmVzdGFkdCBRdWVkbGluYnVyZ+KAnCIKICAgIH0sCiAgICB7CiAgICAgICJpZCI6ICI1MzA3ZTRjNTVhYTIiLAogICAgICAic2V2ZXJpdHkiOiAiY3JpdGljYWwiLAogICAgICAidGl0bGUiOiAiRGVyIEp1Ymlsw6R1bXN0ZW1wZWwg4oCeQnV0dGVya3VwcGXigJwgd3VyZGUgdmVyc2V0enQgdW5kIGJlZmluZGV0IHNpY2ggaW4gZWluZXIgU2NodXR6aMO8dHRlIGF1ZiBkZW0gS2Fpc2VyLU90dG8tSMO2aGVud2VnIGluIFJpY2h0dW5nIFdhbGxoYXVzZW4iCiAgICB9CiAgXQp9Cg==",
  "sig": "hqGe2RfDrlVNhJlYLB82CFREcBN3r2K3Gnx3KHFfRRza3WFvXHreQhVrxuW94F4YaOCB2wvRwxhzRywswVadAQ=="
}
